"Timestamp","Username","Name of your club","Club Sponsor Teacher","What is the purpose of your club?","What are some activities that take place during a typical meeting?","What best describes the role of your club?","Meeting Day","Meeting Time","Meeting Location","Please upload a photo for the front page of the website","Please upload any additional photos.","","","","",""
"2022/09/05 4:16:34 pm GMT-7","fhsscodingclub@gmail.com","Coding Club","Mr. Hasan","The purpose of this club is to allow both beginner and experienced programmers to get together once a week to share ideas and learn. The main focus of the club is to teach beginners how to code, but there will also be more advanced teachings offered to people that already have some coding knowledge. Some examples would be: tutoring for AP Computer Science A, as well as setting teams up for Hackathons.","Members of the club get together at lunchtime each Tuesday at the designated meeting room. Some executives will be in charge of teaching general lessons for everyone, while others may be helping with more advanced topics, or helping newcomers that are new to the club.","Academic: Your club acts to help students on their academic journey.","Tuesday","Lunchtime","","","","link","","tag","code","A programming environment welcoming people of all skill levels."
"2022/10/21 1:03:18 pm GMT-7","","LEO Club","Marie Currie","Service based club which helps out in the school and the community at large. Work actively with Lion's Club of Canada outside of school and on projects within the school.","At meetings, we discuss upcoming events, fundraisers and ways to get involved.  Students also meet to help each other with a variety of activities from resume building, to interview skills to mentorship.  Also have guests come and talk to the group at large on opportunities for community service or ways to support different causes.","Humanitarian","Tuesday;Every other Tuesday","Lunchtime;Sometimes after school for special events","Room 216 (Ms. Parker-Jervis' classroom)","https://drive.google.com/u/0/open?usp=forms_web&id=1PtxdrzTqdOBIhbcoKsUY2xTkkfoQ3Vvv","https://drive.google.com/u/0/open?usp=forms_web&id=1nhT9Or4r4bMKg1HwcN7B91axTybcTm-u","","","","",""
"2022/10/21 3:43:48 pm GMT-7","","BC Children's Hospital Club ","Ms. Gonsales ","At BC Children’s Hospital Club we contribute our fullest abilities to create inspiring and creative fundraising events. Our initiatives connect and inform students about raising awareness and donations for the children and families in need. Students also come together to practice leadership skills and responsibilities, while expanding their personal interests and passion.","Class brainstorming sessions, separate executive meetings, club games and activities, poster painting and etc.","Fundraising and social club","Wednesday","Lunchtime","Room D104","https://drive.google.com/u/0/open?usp=forms_web&id=11NBuWKnQB_J2rtvzn_wYtWmXv3U0N2n5","https://drive.google.com/u/0/open?usp=forms_web&id=18_3ynZC0kcFkmyjAcGh8mYWsAhBUgGkU;https://drive.google.com/u/0/open?usp=forms_web&id=168GM7kWaJDZyOFWWOGj5fmXBnHjWS-4_;https://drive.google.com/u/0/open?usp=forms_web&id=1dJr4nM-LJ2mW0LZsFpANbsc3EKqxoRgO;https://drive.google.com/u/0/open?usp=forms_web&id=1DijZnw9xccT3f_44JUofX3EBWT2bjtk7;https://drive.google.com/u/0/open?usp=forms_web&id=1ooEr20OjkjxcYuIEUA7A4o-YCEolBQQ-;https://drive.google.com/u/0/open?usp=forms_web&id=1zywobIuHejpjtwl87Gem1LVpp79wtI_Q;https://drive.google.com/u/0/open?usp=forms_web&id=1Bx7EOSGx0SR4oeY2IRpvtuiH3WbDlugw;https://drive.google.com/u/0/open?usp=forms_web&id=1p31mYHP-Ofb-wmAvMsCfm789aBo2H6Oh;https://drive.google.com/u/0/open?usp=forms_web&id=1BkYgJYeujHo91YgP9PUjDoCA__Ne4W5V;https://drive.google.com/u/0/open?usp=forms_web&id=13yycnsSGPn1jYju-K6L93ySD9r66LnHU","","","","",""
"2022/10/22 10:32:57 am GMT-7","","Reach for the Top","Mr. Hasan","To create and prepare teams to participate in the Reach for the Top trivia competition.","Practice trivia games, coaching.","Academic","Friday","Lunchtime","Room 103","https://drive.google.com/u/0/open?usp=forms_web&id=1XluFCR0XMXah7YYbviirXYDtJKrXGok6","","","","","",""
"2022/10/22 11:02:27 am GMT-7","","Cultural diversity club ","Ms.kambo","To celebrate the diversity of cultures at FH to instill positive personal & cultural identity ","Planning for acknowledging global holidays and activities at FH ","Humanitarian","Wednesday;Every other Wednesday ","Lunchtime","D 201","https://drive.google.com/u/0/open?usp=forms_web&id=18S9bZGtHUU38lGFdzl33oi-mjV8n4Hgg","","","","","",""
"2022/10/22 11:05:40 am GMT-7","","FH Helping Hands  ","Ms. Kambo ","Volunteering in the school & community ","Planning for our Weekly litter pickups afterschool Thursday, bases buddies, and helping senior citizens ","Humanitarian","Wednesday","Lunchtime;Every other Wednesday ","D201","https://drive.google.com/u/0/open?usp=forms_web&id=18MsT7eJE9sn12MaeGzWo-VYlVbl3-rXp","","","","","",""
"2022/10/22 11:07:31 am GMT-7","","FH Pride club GSA ","Ms. Kambo","To provide a space for LGBTQ community and allies to plan and discuss inclusivity ","Plan for pride events and important days ","Humanitarian","Monday;Every other Monday ","Lunchtime","D 201","https://drive.google.com/u/0/open?usp=forms_web&id=10bPO9EKOuI9XSvZje16Zvc7S5uEc-3d-","","","","","",""
"2022/10/23 4:42:19 pm GMT-7","","Hawk Word","Mr. Kelly","To represent the Fraser Heights creative community in monthly newspaper issues, giving students the opportunity to share their voices and keep informed on things going on around the community. ","Brainstorming ideas, assigning editors/layout artists, discussing suggestions, etc. ","School newspaper","Friday","Lunchtime","Room 217","https://drive.google.com/u/0/open?usp=forms_web&id=12eL4OfIQ30l3PiQfTSwTta4HWZ4e_KAQ","https://drive.google.com/u/0/open?usp=forms_web&id=1XSuUREFoKZbv57Ga8qV8buDoO9OOJlwO","","","","",""
"2022/10/23 4:51:09 pm GMT-7","","Esports Club","Mr. Ho","To build a community of gamers that can be free and have a comfortable place to be in.","Socializing, watching gaming events, playing video games","Social","Friday","After School","Room 204","https://drive.google.com/u/0/open?usp=forms_web&id=1mPm58VKZ7bBGNEPJP_wRRchhBIt5YBNF","","","","","",""
"2022/10/24 10:48:47 am GMT-7","","International Ambassadors Club","Mr. Clarke & Ms. Muni-Xiao","The International Ambassador Club is dedicated to promoting cultural understanding and equality amongst our large International Student population at Fraser Heights Secondary. The International Ambassador’s hold monthly meetings and accept all students in its membership. The Ambassador’s work with new and returning International Students to develop community and a sense of belonging in our school and in the community at large. The International Ambassador Club is an avenue to foster strong relationships with peers and staff and share in cultural celebrations. ","Create a space for belonging and connectedness amongst students (ELL and International) Host new student orientations. Create resources, events and opportunities to support new Fraser Heights Firehawks (such as YouTube videos that help new students in their first language to sign up for lockers, access MyEd, download the app, etc.). Host International Lunches, cultural events and holidays. ","Social","Monday","Lunchtime","209","","","","","","",""
"2022/10/24 7:05:14 pm GMT-7","","Coding Club","Mr. Hasan","1. To build a community of enthusiastic programmers that help each other
2. To teach beginners the basics of programming, so that some of them would build a passion or interest in programming
3. To have fun by coding, by giving out candies and hosting events like kahoots, competitions, game jams, etc.
4. To provide help with events like AP Computer Science and CCC","Normally, we would split into two small groups, junior (no experience ~ beginner) and senior (more experienced). Juniors will
learn the basics of programming using Java, and seniors will be given some challenges or projects to do. And for both groups, free
candies if you do something correctly! All throughout the meeting execs will be available for help. 
We have bi-monthly coding competitions with awards, as well as other events.","Academic","Tuesday","Lunchtime","103","","","","","","",""
"2022/10/29 6:33:59 pm GMT-7","","Mock Trials","Ms. Rakkar","To educate students on legal proceedings, while practicing public speaking by preparing mock cases.","Lessons and drills on mock trial speaking positions, official mock trials (including inter-club tournaments, and possible provincial-held tournaments), tournament preparation for members competing in official mock trials, and fun speech practices with impromptu topics.","Academic","Monday","After School","Room 213","","","","","","",""
"2022/10/29 6:35:39 pm GMT-7","","Debate Club","Ms. Rakkar","To teach students and help them improve their speaking skills in debate on all levels.","In every meeting, the club engages its members on a variety of different activities from lessons to full on debates to help them critically expand their debating abilities and argumentation.","Academic","Tuesday","After School","Room 213","","","","","","",""
"2022/10/29 6:39:04 pm GMT-7","","Dance Club","Ms. Rakkar","To provide friendly dance lessons to people of all levels","Dance Lessons, Games, etc.","Social","Wednesday","Lunchtime","NLC","","","","","","",""
"2022/11/08 4:09:19 pm GMT-8","","Student Council","Mrs. Brar, Ms. Gonsales, Ms. Wong","We create a space that allows students to have a chance to lead and collaborate to further build a positive school environment and culture. We promote positive school activities and host fun spirit events! We promote spirit within the school.","Every week theres something new! We brainstorm, plan, and organize school spirit events. We work as a team to create a fun and enthusiastic school environment by sharing ideas with with the team. We turn ideas into actions! ","Spirit","Tuesday","Lunchtime","Mrs. Brars room D105","https://drive.google.com/u/0/open?usp=forms_web&id=1LxKZCy8sDY2E7V3K3r8j9t8M8j0Lr-rw","https://drive.google.com/u/0/open?usp=forms_web&id=1tEBver7FUisc0QITmxkhCPf3eCBDJ4LK;https://drive.google.com/u/0/open?usp=forms_web&id=1xUbthJrLsla0gz6xZKVGiHZcPPbpw_l4;https://drive.google.com/u/0/open?usp=forms_web&id=1VxnoK-hMWuVguKIbyVJ_ygm-4BlOTFHp;https://drive.google.com/u/0/open?usp=forms_web&id=1xbgZllujAo12SNQQ3bNocSuNkoCxQukq","","","","",""
"2022/11/08 4:11:54 pm GMT-8","","Homework Club","Amy Grewal","Homework club is run by a group of Fraser Heights Students who are eager to help out students in various subjects. This club is great for students who'd like extra help on assignments from a knowledgeable peer. It’s a welcoming and warm environment that’s enjoyable for students.","Students create posters, discuss how to spread the word about the club, and most importantly assist peers with their assignments","Academic","Monday;Tuesday;Thursday","Lunchtime","Room 210","https://drive.google.com/u/0/open?usp=forms_web&id=1hsyqjTKKI6typNxA8yjpyhn_zOQUFXId","","","","","",""
"2022/11/08 4:15:19 pm GMT-8","","FH Environment Club","Ms. Sereda","To obtain a sustainable lifestyle and combat climate change through individual actions. ","Battery challenge, pens and markers collection, litter pickups","Social","Thursday","Lunchtime","Room 203","https://drive.google.com/u/0/open?usp=forms_web&id=1_Aowg2jvlIrWIuVrHePRwNjwU80cnvjg","https://drive.google.com/u/0/open?usp=forms_web&id=1KlpT2GGZqp8YNtoKyvwyF0IeX4zmUFk8;https://drive.google.com/u/0/open?usp=forms_web&id=1x2Gg12gBOctXnzDobfjpZR_kPCLlPJUI;https://drive.google.com/u/0/open?usp=forms_web&id=1oBy8ym_zq0K5vxNC0ax5etIa2OJJ7Y3G","","","","",""
"2022/11/08 4:37:09 pm GMT-8","","Ethics Bowl ","Ms. Balikis ","Holding competitive and collaborative team discussions where students analyze, criticize, and compare ethical dilemmas. This provides students the opportunity to think critically, apply their knowledge in the real world, and deepen their awareness of ethical values. ","In a typical Ethics Bowl meeting, students discuss and analyze case studies that involve political, social, or economic dilemmas. Students practice their public speaking and critical thinking skills by splitting up into two teams and proposing solutions to ethical issues. Coaches also train students on philosophical perspectives and speaking strategies, preparing them for upcoming competitions","Academic","Tuesday;Thursday","After School","Room 215 ","https://drive.google.com/u/0/open?usp=forms_web&id=1VO-Q-wkLZ5hyaHxAruWzl0Jnl5bYzP-U","","","","","",""
"2022/11/08 5:13:12 pm GMT-8","","Chess Club","Ms. Rakkar","To provide a social, informative, and fun environment for students to learn and play the game of chess and compete in spirited competitions.","During a typical meeting, we may watch videos on new chess openings and tactics, have mini in-class tournaments, or just play with our peers.","Academic","Friday","Lunchtime","Room 213","https://drive.google.com/u/0/open?usp=forms_web&id=1MoQYzF-CB-3BbDTz2v7vsCB8grJG1npH","","","","","",""